[
  {
    "player_id": "1630639",
    "name": "A.J. Lawson",
    "team": "TOR",
    "position": "PG",
    "status": "active"
  },
  {
    "player_id": "1631260",
    "name": "AJ Green",
    "team": "MIL",
    "position": "PG",
    "status": "active"
  },
  {
    "player_id": "1642358",
    "name": "AJ Johnson",
    "team": "WAS",
    "position": "PG",
    "status": "active"
  },
  {
    "player_id": "203932",
    "name": "Aaron Gordon",
    "team": "DEN",
    "position": "SF",
    "status": "active"
  },
  {
    "player_id": "1628988",
    "name": "Aaron Holiday",
    "team": "HOU",
    "position": "PG",
    "status": "active"
  },
  {
    "player_id": "1630174",
    "name": "Aaron Nesmith",
    "team": "IND",
    "position": "SG",
    "status": "active"
  },
  {
    "player_id": "1630598",
    "name": "Aaron Wiggins",
    "team": "OKC",
    "position": "PG",
    "status": "active"
  },
  {
    "player_id": "1641745",
    "name": "Adam Flagler",
    "team": "OKC",
    "position": "PG",
    "status": "active"
  },
  {
    "player_id": "1641737",
    "name": "Adem Bona",
    "team": "PHI",
    "position": "SF",
    "status": "active"
  },
  {
    "player_id": "1642349",
    "name": "Ajay Mitchell",
    "team": "OKC",
    "position": "PG",
    "status": "active"
  },
  {
    "player_id": "201143",
    "name": "Al Horford",
    "team": "BOS",
    "position": "PF",
    "status": "active"
  },
  {
    "player_id": "202692",
    "name": "Alec Burks",
    "team": "MIA",
    "position": "PG",
    "status": "active"
  },
  {
    "player_id": "1627936",
    "name": "Alex Caruso",
    "team": "OKC",
    "position": "PG",
    "status": "active"
  },
  {
    "player_id": "1642505",
    "name": "Alex Ducas",
    "team": "OKC",
    "position": "PG",
    "status": "active"
  },
  {
    "player_id": "203458",
    "name": "Alex Len",
    "team": "LAL",
    "position": "C",
    "status": "active"
  },
  {
    "player_id": "1642024",
    "name": "Alex Reese",
    "team": "PHI",
    "position": "PF",
    "status": "active"
  },
  {
    "player_id": "1642259",
    "name": "Alex Sarr",
    "team": "WAS",
    "position": "C",
    "status": "active"
  },
  {
    "player_id": "1630578",
    "name": "Alperen Sengun",
    "team": "HOU",
    "position": "C",
    "status": "active"
  },
  {
    "player_id": "1641708",
    "name": "Amen Thompson",
    "team": "HOU",
    "position": "SG",
    "status": "active"
  },
  {
    "player_id": "1629599",
    "name": "Amir Coffey",
    "team": "LAC",
    "position": "SG",
    "status": "active"
  },
  {
    "player_id": "203083",
    "name": "Andre Drummond",
    "team": "PHI",
    "position": "C",
    "status": "active"
  },
  {
    "player_id": "1641748",
    "name": "Andre Jackson Jr.",
    "team": "MIL",
    "position": "PG",
    "status": "active"
  },
  {
    "player_id": "1629614",
    "name": "Andrew Nembhard",
    "team": "IND",
    "position": "SG",
    "status": "active"
  },
  {
    "player_id": "203952",
    "name": "Andrew Wiggins",
    "team": "MIA",
    "position": "SF",
    "status": "active"
  },
  {
    "player_id": "1629014",
    "name": "Anfernee Simons",
    "team": "POR",
    "position": "PG",
    "status": "active"
  },
  {
    "player_id": "1641710",
    "name": "Anthony Black",
    "team": "ORL",
    "position": "PG",
    "status": "active"
  },
  {
    "player_id": "203076",
    "name": "Anthony Davis",
    "team": "DAL",
    "position": "PF",
    "status": "active"
  },
  {
    "player_id": "1630162",
    "name": "Anthony Edwards",
    "team": "MIN",
    "position": "PG",
    "status": "active"
  },
  {
    "player_id": "1630264",
    "name": "Anthony Gill",
    "team": "WAS",
    "position": "SF",
    "status": "active"
  },
  {
    "player_id": "1641810",
    "name": "Antonio Reeves",
    "team": "NOP",
    "position": "PG",
    "status": "active"
  },
  {
    "player_id": "1630574",
    "name": "Ariel Hukporti",
    "team": "NYK",
    "position": "C",
    "status": "active"
  },
  {
    "player_id": "1641709",
    "name": "Ausar Thompson",
    "team": "DET",
    "position": "SG",
    "status": "active"
  },
  {
    "player_id": "1630559",
    "name": "Austin Reaves",
    "team": "LAL",
    "position": "PG",
    "status": "active"
  },
  {
    "player_id": "1630245",
    "name": "Ayo Dosunmu",
    "team": "CHI",
    "position": "PG",
    "status": "active"
  },
  {
    "player_id": "1628389",
    "name": "Bam Adebayo",
    "team": "MIA",
    "position": "PF",
    "status": "active"
  },
  {
    "player_id": "1631248",
    "name": "Baylor Scheierman",
    "team": "BOS",
    "position": "PG",
    "status": "active"
  },
  {
    "player_id": "1641767",
    "name": "Ben Sheppard",
    "team": "IND",
    "position": "PG",
    "status": "active"
  },
  {
    "player_id": "1627732",
    "name": "Ben Simmons",
    "team": "LAC",
    "position": "SG",
    "status": "active"
  },
  {
    "player_id": "1631097",
    "name": "Bennedict Mathurin",
    "team": "IND",
    "position": "SG",
    "status": "active"
  },
  {
    "player_id": "1641731",
    "name": "Bilal Coulibaly",
    "team": "WAS",
    "position": "PG",
    "status": "active"
  },
  {
    "player_id": "202687",
    "name": "Bismack Biyombo",
    "team": "SAS",
    "position": "C",
    "status": "active"
  },
  {
    "player_id": "1631104",
    "name": "Blake Wesley",
    "team": "SAS",
    "position": "PG",
    "status": "active"
  },
  {
    "player_id": "1626171",
    "name": "Bobby Portis",
    "team": "MIL",
    "position": "SF",
    "status": "active"
  },
  {
    "player_id": "203992",
    "name": "Bogdan Bogdanovi\u0107",
    "team": "LAC",
    "position": "PG",
    "status": "active"
  },
  {
    "player_id": "1629626",
    "name": "Bol Bol",
    "team": "PHX",
    "position": "PF",
    "status": "active"
  },
  {
    "player_id": "1630538",
    "name": "Bones Hyland",
    "team": "MIN",
    "position": "PG",
    "status": "active"
  },
  {
    "player_id": "203078",
    "name": "Bradley Beal",
    "team": "PHX",
    "position": "PG",
    "status": "active"
  },
  {
    "player_id": "1642382",
    "name": "Branden Carlson",
    "team": "OKC",
    "position": "C",
    "status": "active"
  },
  {
    "player_id": "1641764",
    "name": "Brandin Podziemski",
    "team": "GSW",
    "position": "PG",
    "status": "active"
  },
  {
    "player_id": "1630527",
    "name": "Brandon Boston",
    "team": "NOP",
    "position": "PG",
    "status": "active"
  },
  {
    "player_id": "1629634",
    "name": "Brandon Clarke",
    "team": "MEM",
    "position": "SF",
    "status": "active"
  },
  {
    "player_id": "1627742",
    "name": "Brandon Ingram",
    "team": "NOP",
    "position": "SF",
    "status": "active"
  },
  {
    "player_id": "1641706",
    "name": "Brandon Miller",
    "team": "CHA",
    "position": "SF",
    "status": "active"
  },
  {
    "player_id": "1630314",
    "name": "Brandon Williams",
    "team": "DAL",
    "position": "PG",
    "status": "active"
  },
  {
    "player_id": "1641729",
    "name": "Brice Sensabaugh",
    "team": "UTA",
    "position": "SF",
    "status": "active"
  },
  {
    "player_id": "1642355",
    "name": "Bronny James",
    "team": "LAL",
    "position": "PG",
    "status": "active"
  },
  {
    "player_id": "201572",
    "name": "Brook Lopez",
    "team": "MIL",
    "position": "C",
    "status": "active"
  },
  {
    "player_id": "1628971",
    "name": "Bruce Brown",
    "team": "NOP",
    "position": "SG",
    "status": "active"
  },
  {
    "player_id": "1628981",
    "name": "Bruno Fernando",
    "team": "TOR",
    "position": "PF",
    "status": "active"
  },
  {
    "player_id": "1631121",
    "name": "Bryce McGowens",
    "team": "POR",
    "position": "PG",
    "status": "active"
  },
  {
    "player_id": "1642267",
    "name": "Bub Carrington",
    "team": "WAS",
    "position": "PG",
    "status": "active"
  },
  {
    "player_id": "1627741",
    "name": "Buddy Hield",
    "team": "GSW",
    "position": "PG",
    "status": "active"
  },
  {
    "player_id": "203468",
    "name": "CJ McCollum",
    "team": "NOP",
    "position": "PG",
    "status": "active"
  },
  {
    "player_id": "1630595",
    "name": "Cade Cunningham",
    "team": "DET",
    "position": "PG",
    "status": "active"
  },
  {
    "player_id": "1631216",
    "name": "Caleb Houstan",
    "team": "ORL",
    "position": "PG",
    "status": "active"
  },
  {
    "player_id": "1628997",
    "name": "Caleb Martin",
    "team": "DAL",
    "position": "SF",
    "status": "active"
  },
  {
    "player_id": "1642353",
    "name": "Cam Christie",
    "team": "LAC",
    "position": "PG",
    "status": "active"
  },
  {
    "player_id": "1629629",
    "name": "Cam Reddish",
    "team": "LAL",
    "position": "SG",
    "status": "active"
  },
  {
    "player_id": "1642285",
    "name": "Cam Spencer",
    "team": "MEM",
    "position": "PG",
    "status": "active"
  },
  {
    "player_id": "1630560",
    "name": "Cam Thomas",
    "team": "BKN",
    "position": "PG",
    "status": "active"
  },
  {
    "player_id": "1641715",
    "name": "Cam Whitmore",
    "team": "HOU",
    "position": "SF",
    "status": "active"
  },
  {
    "player_id": "1629661",
    "name": "Cameron Johnson",
    "team": "BKN",
    "position": "SF",
    "status": "active"
  },
  {
    "player_id": "1626166",
    "name": "Cameron Payne",
    "team": "NYK",
    "position": "PG",
    "status": "active"
  },
  {
    "player_id": "1627747",
    "name": "Caris LeVert",
    "team": "ATL",
    "position": "PG",
    "status": "active"
  },
  {
    "player_id": "1641717",
    "name": "Cason Wallace",
    "team": "OKC",
    "position": "PG",
    "status": "active"
  },
  {
    "player_id": "1629646",
    "name": "Charles Bassey",
    "team": "SAS",
    "position": "PF",
    "status": "active"
  },
  {
    "player_id": "1631096",
    "name": "Chet Holmgren",
    "team": "OKC",
    "position": "PF",
    "status": "active"
  },
  {